{
  "applicability": "proposed",
  "bundle_id": "sha256:b33eb169603c09ea84cb807ea3823c298ff2bc8366dfd0b6ab16dae124994a83",
  "concise_rationale": "The object is a long rectangular prism (key) with a clear axial load path along the Y-axis (length 30.03mm). The opposed regions axis:y:min and axis:y:max are the large end faces suitable for axial tension/compression.",
  "confidence": 0.95,
  "fixed_region_id": "axis:y:min",
  "item_id": "p_benchcad_000521",
  "load_direction": {
    "axis": "y",
    "sign": 1
  },
  "loaded_region_id": "axis:y:max",
  "output_status": "complete",
  "reason_code": "clear_axial_load_path",
  "risk_flags": [],
  "role_id": "l3_physics_probe_annotator",
  "scenario_family": "axial_tension",
  "schema_version": "cadengbench-p.l3-annotation-candidate.v1",
  "source_intent_claimed": false
}
