{
  "applicability": "proposed",
  "bundle_id": "sha256:da818232d3624935c1429c1dd2c9455c71c627b09fd42ddad97667e3b0443b2a",
  "concise_rationale": "The object is a prismatic bar (parallel key) with a clear axial load path along the x-axis. The x-axis is the longest dimension, making it the dominant structural span for axial loading.",
  "confidence": 0.95,
  "fixed_region_id": "axis:x:min",
  "item_id": "p_benchcad_000518",
  "load_direction": {
    "axis": "x",
    "sign": 1
  },
  "loaded_region_id": "axis:x:max",
  "output_status": "complete",
  "reason_code": "clear_axial_load_path",
  "risk_flags": [],
  "role_id": "l3_physics_probe_annotator",
  "scenario_family": "axial_tension",
  "schema_version": "cadengbench-p.l3-annotation-candidate.v1",
  "source_intent_claimed": false
}
