{
  "applicability": "proposed",
  "bundle_id": "sha256:2d11aad6561acf34d42fd65cf5d5bebd2727409cf0924211da96c6f202f42d72",
  "concise_rationale": "The hex standoff exhibits a clear axial load path along the Z-axis (through-hole direction). The opposed regions axis:z:min and axis:z:max represent the flat faces of the hexagonal body, suitable for a conservative axial tension/compression",
  "confidence": 0.95,
  "fixed_region_id": "axis:z:min",
  "item_id": "p_benchcad_000333",
  "load_direction": {
    "axis": "z",
    "sign": 1
  },
  "loaded_region_id": "axis:z:max",
  "output_status": "complete",
  "reason_code": "clear_axial_load_path",
  "risk_flags": [],
  "role_id": "l3_physics_probe_annotator",
  "scenario_family": "axial_tension",
  "schema_version": "cadengbench-p.l3-annotation-candidate.v1",
  "source_intent_claimed": false
}
