{
  "applicability": "proposed",
  "bundle_id": "sha256:277304e3b11da24b7204348ffae42bbf1c575c3d2d25d387b7bb4602a0387678",
  "concise_rationale": "The geometry is a thin, uniform-thickness star plate. The only eligible opposed regions are the top and bottom faces (Z-axis). This configuration supports a clear axial tension/compression probe along the thickness.",
  "confidence": 0.9,
  "fixed_region_id": "axis:z:min",
  "item_id": "p_benchcad_000757",
  "load_direction": {
    "axis": "z",
    "sign": 1
  },
  "loaded_region_id": "axis:z:max",
  "output_status": "complete",
  "reason_code": "clear_axial_load_path",
  "risk_flags": [
    "thin_shell_like"
  ],
  "role_id": "l3_physics_probe_annotator",
  "scenario_family": "axial_tension",
  "schema_version": "cadengbench-p.l3-annotation-candidate.v1",
  "source_intent_claimed": false
}
