{
  "applicability": "proposed",
  "bundle_id": "sha256:30d8f43566be5784fa68a3534da71b9b511e12197b1d85c88626ace10aaab0ac",
  "concise_rationale": "The geometry is a solid right circular cylinder with a clear axial load path along the Z-axis. The opposed regions axis:z:min and axis:z:max are flat, parallel end faces suitable for fixed and loaded boundary conditions in an axial tension/",
  "confidence": 0.95,
  "fixed_region_id": "axis:z:min",
  "item_id": "p_fusion360_001017",
  "load_direction": {
    "axis": "z",
    "sign": 1
  },
  "loaded_region_id": "axis:z:max",
  "output_status": "complete",
  "reason_code": "clear_axial_load_path",
  "risk_flags": [],
  "role_id": "l3_physics_probe_annotator",
  "scenario_family": "axial_tension",
  "schema_version": "cadengbench-p.l3-annotation-candidate.v1",
  "source_intent_claimed": false
}
